{
  "store": "ontology/goals",
  "version": 3,
  "status": "seeded",
  "closed_list": true,
  "owner": "Client business owner (NOT L&D) — see goal.schema.json",
  "_note": "v2, 2026-08-25: added goal_alsap_asset_safety_monitored, distilled from the live SOP-AST-29080 atom store (ast_alsap). Status on that node is draft — the SOP is real; a client has not ratified the outcome statement. The AST009 PSI goal remains status:example. Schema is shared core; these INSTANCES are per-engagement content that currently live in the core seed because no per-project ontology store exists yet. v3, 2026-08-31: added goal_bw_pay_understood for the Brunswick pay-transparency drive (first non-Astellas client; projects/paytrans). Status draft — BPS-drafted from the SOW and client LO documents; not client-ratified.",
  "goals": {
    "goal_ast009_psi_reported_on_time": {
      "label": "Product safety information reaching the company is recognised and reported within the required window, without relying on individual vigilance.",
      "measure": "Proportion of inbound PSI-bearing contacts that are reported inside the regulatory window, and the count of late or missed reports found on audit.",
      "owner": "role_gso",
      "reachability": {
        "trainable": "Recognition. Staff who encounter a contact cannot report what they do not identify as product safety information in the first place — that is a knowledge and discrimination problem, and it is the part instruction can move.",
        "not_trainable": [
          "Reporting channel friction — if the intake path is slow or unclear, trained staff still report late. Process, not instruction.",
          "Workload and staffing — recognition under time pressure degrades regardless of how well someone was taught.",
          "Incentive structure — where reporting is perceived to create work or risk for the reporter, training does not overcome it."
        ],
        "assessed_by": "role_alsap_lead",
        "assessed_on": "2026-08-21",
        "rationale": "The two seeded objectives (define PSI, recognise PSI) both sit squarely on the recognition half. Naming the other three causes explicitly keeps a later audit from reading a flat reporting rate as a training failure — which is the failure mode this gate exists to prevent."
      },
      "status": "example",
      "derived_from": "AST009 reference programme; the outcome implied by atom-spec §4's objectives, made explicit here for the first time."
    },
    "goal_alsap_asset_safety_monitored": {
      "label": "Emerging safety risks at the asset level are identified, evaluated, and communicated through a single maintained ALSAP during clinical development.",
      "measure": "Proportion of in-scope assets with a current ALSAP (annual SMT review complete; ad hoc updates after signals, regulatory changes, or milestones), and the count of assets proceeding in development without one.",
      "owner": "role_gso",
      "reachability": {
        "trainable": "Knowing what an ALSAP is and that one exists per asset; who is in scope; and how to run the three procedure cycles the SOP names (plan development, develop/maintain/approve, analysis datasets and TLFs including protecting the blind). Those are knowledge and procedure-following problems instruction can move.",
        "not_trainable": [
          "EDMS or SCE friction — if filing, routing, or restricted-folder access is slow, a trained ALSAP Lead still misses windows. Process, not instruction.",
          "SMT meeting culture and schedule — alignment and review cycles fail when the forum does not meet, regardless of how well the SOP was taught.",
          "Data quality that triggers ad hoc updates, and the regulatory changes themselves — those are inputs to the plan, not outputs of training.",
          "Workload that compresses the 10-business-day review — training does not create calendar time."
        ],
        "assessed_by": "role_alsap_lead",
        "assessed_on": "2026-08-25",
        "rationale": "SOP-AST-29080 exists to operationalize asset-level safety monitoring. The trainable slice is the procedure the atoms already state. Naming EDMS, SMT cadence, data quality, and workload as not-trainable keeps a later missing-ALSAP count from being read as a training failure."
      },
      "status": "draft",
      "derived_from": "Live SOP-AST-29080 atom store (cgen/astellas/projects/ast_alsap/atoms.json). Distilled from the procedure's purpose, general statement, and three procedure sections. Not client-ratified — Jake merging the Cartographer PR is the first human look, not a lock."
    },
    "goal_bw_pay_understood": {
      "label": "Brunswick salaried employees understand how pay is determined — the philosophy, the factors, and base pay's place in total rewards — and know where to find their own compensation information, so that pay transparency lands as informed understanding rather than unexplained numbers.",
      "measure": "Optional employee eLearning completion and embedded check performance (SOW §5); downstream, the quality of pay conversations employees initiate — measured through the manager/HR channel the program equips separately.",
      "owner": "role_bw_ehrc_paytrans_team",
      "reachability": {
        "trainable": "Understanding. What the philosophy is, which factors set a salary, how base pay sits inside total rewards, where Workday and the Total Rewards Statement live, and that EU-specific rights exist — all knowledge and orientation, exactly what an awareness course can move.",
        "not_trainable": [
          "Actual pay outcomes and pay equity itself — properties of the compensation structure and its administration, not of anything a learner is taught.",
          "Trust in the fairness of pay — built or broken in real conversations with managers and in lived outcomes; the course can inform it, not produce it.",
          "Manager conversation quality — the other half of the program (required manager course, drive two), not this optional awareness piece.",
          "Regulatory compliance itself — a legal and process obligation Brunswick meets by disclosure practices, not by employee training."
        ],
        "assessed_by": "role_bw_ehrc_paytrans_team",
        "assessed_on": "2026-08-31",
        "rationale": "Drafted by BPS (instructional designer) from the SOW, the client-ready LO document, and the LO revision analysis — whose 'confidence builds through practice over time' note is this same judgment made in the wild a year early, for the manager half. Status draft: Brunswick has not ratified this statement of the outcome; Jake's merge ratifies the DRAFT as BPS's working warrant, not as client sign-off."
      },
      "status": "draft",
      "derived_from": "doc_bw_sow_paytrans_education §1–5 (audiences, timing, measurement); doc_bw_learner_objectives_paytrans (employee section); LO_Revision_Summary.md (the not-trainable reasoning)."
    }
  }
}